{
  "id": "review-analyst-20260410-111000",
  "contribution_id": "contrib-design-20260410-101500",
  "reviewer_function": "analyst-reviewer",
  "round": 1,
  "passed": true,
  "issues": [],
  "strengths": [
    "Gamification UX patterns are well-researched with clear competitive benchmarks",
    "Prototype effectively demonstrates the savings streak mechanic with realistic UI",
    "Experience audit identifies key friction points in the current Pro upgrade flow"
  ],
  "revisions_required": [],
  "created_at": "2026-04-10T11:10:00Z"
}
