{
  "id": "review-eng-20260405-121000",
  "contribution_id": "contrib-eng-20260405-120300",
  "reviewer_function": "engineering-reviewer",
  "round": 1,
  "passed": false,
  "issues": [
    "InstaShop reuse estimate (40% less effort) lacks validation with the integration team who owns that component"
  ],
  "strengths": [
    "Feasibility assessments grounded in actual code review of cart-service repo and slot allocation API",
    "Effort estimates broken down by component with uncertainty flagged for cart service changes"
  ],
  "revisions_required": [
    "Validate InstaShop component reuse estimate with integration team or flag as high-uncertainty"
  ],
  "created_at": "2026-04-05T12:10:00Z"
}
