{
  "id": "review-data-20260405-121000",
  "contribution_id": "contrib-data-20260405-120200",
  "reviewer_function": "data-reviewer",
  "round": 1,
  "passed": true,
  "issues": [],
  "strengths": [
    "Data sources are recent (90 days) and properly scoped to target persona segments",
    "Counter-signal on delivery slots is significant and properly weighted against supporting evidence",
    "Confidence levels appropriately reflect data quality — direct measurement scored higher than derived analysis"
  ],
  "revisions_required": [],
  "created_at": "2026-04-05T12:10:00Z"
}
