{
  "id": "review-design-20260405-121000",
  "contribution_id": "contrib-design-20260405-120100",
  "reviewer_function": "design-reviewer",
  "round": 1,
  "passed": true,
  "issues": [],
  "strengths": [
    "Solution approaches are genuinely different — persistent list vs slot visualization vs incremental UX",
    "Prototype tests a clear hypothesis about substitution control reducing abandonment",
    "Experience audit honestly acknowledges power user disruption risk"
  ],
  "revisions_required": [],
  "created_at": "2026-04-05T12:10:00Z"
}
